Act name,Text id,Text,Date,Source,Page
Revenue Act of 1945,1,"full employment in peacetime can be assured only when the reduction in war demand is approximately  offset by additional peacetime demand from the millions of consumers, businesses, and farmers",01/03/2045,,8
Revenue Act of 1945,2,we must overhaul the wartime tax structure to stimulate consumers’ demand and to promote business investment.  The elements of such a tax program should be devel oped now so  that it can be put into effect after victory,,,9
Revenue Act of 1945,3,I recommend that a trans itional  tax bill be enacted as soon as possible to provide limited tax reductions for the calendar year 1946.  … [T]he new bill should aim principally at removing barriers to speedy reconversion and to the expansion of  our peacetime economy,,,12
Revenue Act of 1945,4,"No backlog of demand can exist very long in the face of our tremendous productive capacity.  We must expect again to face the pr oblem of  shrinking demand and consequent slackening in sales, production, and employment.  This possibility of a  deflationary spiral in the future will exist unless we now plan and adopt an effective full employment  program",1/21/46,,9
Revenue Act of 1945,5,were designed to encourage reconversion and peacetime business expansion,,,25
Revenue Act of 1945,6,We must reconcile ourselves to the fact that room for tax  reduction at this time is limited.  A total war effort cannot be liquidated overnight,09/06/2045,Special Message to the Congress,13
Revenue Act of 1945,7,these are deflationary factors,,1946 Treasury Annual Report,328
Revenue Act of 1945,8,"such deflationary dangers as we face are the byproducts … of a titanic  physical change -over from war production to peace production.  … Therefore, one of the primary  objectives of our fiscal policy must be to encourage the boldest, the quickest and most venturesome  expansion of peacetime enterprise by business investors",,,328
Revenue Act of 1945,9,[t]ax reduct ion for 1946 should be designed to afford the maximum aid and stimulus to reconversion and  expansion that is compatible with our revenue needs,,,329
Revenue Act of 1945,10,The bill  has been designed to aid both individuals and businesses in the difficult period of transition from war to peace.  To accomplish this your committee believes that  it is necessary to reduce the high wartime tax  rates to provide incentives for business to expand and to increase consumer purchasing power,10/09/2045,"79 th Congress, 1st Session, House of Representatives Report No. 1106",1
Revenue Act of 1945,11,"Federal expenditures for calendar year     19   1946 are expected to be much lower, but it is anticipated that the deficit will still be sizable.  In view of  the probable extent of the deficit in 1946 it  is necessary to limit the over -all reduction in taxes",,,1
Revenue Act of 1945,12,"All things considered —the modesty of the reductions made, the nature of the reductions, the  prospects of a dwindling Fe deral budget, and the encouragement given to the production and sale of  goods —the new law should greatly aid the reestablishment of a healthful economic environment",,"79th Congress, 1st Session, House Document No. 383, “Revenue Act of 1945: Summary of Pri ncipal Provisions and Questions and Answers, ” 1945",2
Social Security Amendments of 1947,1,cost of benefits under the system [as a percent of  payroll] … are lower than the estimated costs of the program when it was adopted,,,31
Social Security Amendments of 1947,2,increased the annual  rate of cash receipts by about three- quarters of a billion dollars,,,90
Revenue Act of 1948,1,remove the  deterrents to managerial efforts and to the investment of venture capital,3/26/47,"Congressional Record, 80 th Congress, 1st Session, Volume 93—Part 2",2637
Revenue Act of 1948,2,It is the additional  tax taken out of the extra dollar of income … that determines whether or not it is worth while to make the  effort or incur the risk,,,2638
Revenue Act of 1948,3,"H. R. 4790 provides tax reduction, relief, and equalization.  It  reduces the present extremely high rates of the individual income tax.  These rates were a product of  wartime conditions, and constitute a serious obstacle to the increase in production needed to relieve  current inflationary pressures.  The reduction of these rates also is essential to the long -run improvement  in the American standard of living",1/27/48,"80th Congress, 2d session, House of Representatives Report No. 1274",1
Revenue Act of 1948,4,"Your committee’s bill is designed to provide a  stimulus to labor, management, and venture capital",3/16/48,"80th Congress, 2d session, Senate Report No. 1013",1
Revenue Act of 1948,5,your  committee believes that increased production [from improved incentives] is the most satisfactory answer to the high prices resulting from the pressure of pent -up demand on a limited supply,,House Report No. 21 1274,11
Revenue Act of 1948,6,This tax bill is being presented at a time when the future of  business conditions is extremely difficult t o predict,,Senate Report No. 1013,10
Revenue Act of 1948,7,"should business begin to taper off, the effects of the  tax reduction upon incentives to work and to invest would be extremely important , as would also the  additional purchasing power generated by the increase in exemptions",,,13
Revenue Act of 1948,8,"[s]hould such a recession occur, it would be a temporary slump growing out of transition period difficulties and would call for no revision in  our budget policy",,1948 Budget,
Revenue Act of 1948,9,"the bill  would greatly increase the danger of further inflation, by adding billions of dollars of purchasing power at  a time when demand already exceeds supply at many strategic points in the economy",04/02/2048,Veto of the Income Tax Reduction Bill,1
Social Security Amendments of 1950,1,"firmly of the belief that the old -age, survivors, and disability insurance program should be on a  completely self -supporting basis.  Accordingly, the bill eliminates the provision added in 1943  authorizing appropriations to t he program from general revenues",,"81st Congress, 1st Session, House of Representatives Report No. 1300",31
Social Security Amendments of 1950,2,The  schedule of contribution rates was revised to yield larger amounts of future contribution income with a  view not only to meeting the higher benefit outlays of the liberalized program but also to making the  system self -supporting,,,3
Revenue Act of 1950,1,"After the communist aggression in  Korea last summer, the Congress recognized the need for greatly increasing the Government’s revenues  to meet the grave dangers that confront our country",,Letter to Committee Chairmen on Taxation of Excess Profits,1
Revenue Act of 1950,2,An adequate tax program is our strongest weapon in preventing inflation,,,1
Revenue Act of 1950,3,Military action in Korea coupled wi th substantial  increases in defense and related expenditures has made it necessary to convert the excise tax reduction bill  passed by the House in June of this year into a bill to raise revenues,8/22/50,"81 st Congress, 2d Session, Senate Report No. 2375",1
Revenue Act of 1950,4,there is general agreement that these rates must be raised in view of the new expenditures required by the crisis in international af fairs,,,2
Revenue Act of 1950,5,This bill is a first step in the financing of the expanded military program resulting from the war  in Korea,8/24/50,"Congressional Record, 81 st Congress, 2d Session, Volume 96—Part 10",13268
Revenue Act of 1950,6,"It seems  to me that the tax bill … will raise only a small fraction of the revenue which is needed.  It will  necessitate borrowing, and will therefore create inflation",,,13281
Revenue Act of 1950,7,"It is not anticipated that these [tax] increases will be of sufficient size to offset the new defense and related expenditures.  However, this bill accomplishes all that can be done quickly",,Senate Report No. 2375,1
Revenue Act of 1950,8,4.6 billion dollars of  additional revenue annually,,Letter to Committee Chairmen on Taxation of Excess Profits,1
Excess Profits Tax Act of 1950,1,"An increase of 10 billion dollars in milit ary  appropriations, coming at a time when our economy is already operating at near -maximum levels, will  greatly increase demand for goods and for labor, thus putting pressure on our price and wage structure",,,46
Excess Profits Tax Act of 1950,2,to use fiscal and credit policies to the fullest extent  feasible for the restraint of inflationary pressures,,,46
Excess Profits Tax Act of 1950,3,we are determined to finance the defense program without jeopardy to the  stability of  our economic system,01/03/1951,Statement by the President Upon Signing the Excess Profits Tax Act of 1950,1
Excess Profits Tax Act of 1950,4,This bill is a second step  in the financing of the  vastly expanded military program resulting from the hostilities in Korea and the  critical international situation,12/18/50,"81 st Congress, 2d Session, Senate Report No. 2679",1
Revenue Act of 1951,1,"These new taxes are required to finance the defens e  effort; and to help keep total spending within the capacity of current production, so that inflation does not  reduce the purchasing power",,,17
Revenue Act of 1951,2,"If we do not tax ourselves enough to pay for defense  expenditures, the Government will … add to total purchasing power and inflationary pressures",,Special Message to the Congress Recommending a “Pay as We Go” Tax Program,2
Revenue Act of 1951,3,"The military action in Korea, coupled with the general threat to world p eace, has made it  necessary to provide extraordinary increases in revenues to meet essential national defense expenditures",6/18/51,"82d Congress, 1st Session, House of Representatives Report No. 586",1
Revenue Act of 1951,4,"The 12½- percent flat across- the-board increase [in individual  income tax rates] was selected as the form of increase, since it is not intended that this increase will be  permanent, and therefore, it was desired to provide an increase which would not become an integral part  of the rate structure",,,8
Revenue Act of 1951,5,the post -Korea tax increases are not  allowed to run off as provided by present law,,,71
Revenue Act of 1951,6,"The Secretary of the Treasury  therefore announced in the plainest possible language that the Administration, besides relinquishing the  excess- profits tax, would not seek to postpone the reduction of the personal income tax, averaging  approximately 10 percent, scheduled for January 1, 1954",,,52
Revenue Act of 1951,7,"Because o f billions of dollars of savings in Government spending  made in this Administration’s first year, major tax cuts went into effect on January 1",,,
Revenue Act of 1951,8,These tax reductions are justified only because of the substantial  reductions we already have made and are making in governmental expenditures,01/07/1954,Annual Message to the Congress on the State of the Union,6
Revenue Act of 1951,9,well - timed,,,52
Revenue Act of 1951,10,[m]ore than 5 billion dollars,,,
Revenue Act of 1951,11,On January 1 st this year  your taxes were cut by five billion dollars,,Radio and Television Address to the American People on the Tax Program,2
Excise Tax Reduction Act of 1954,1,"The reductions in expenditures already ac complished,     28   together with those now proposed, justify the tax reductions which took effect January 1 [1954] and the  further tax revisions I am recommending",1/21/54,,2
Excise Tax Reduction Act of 1954,2,"Without these savings, there could have been no  tax relief for anyone.  Because of these savings, your tax cuts were possible.  On January 1st this year your  taxes were cut by five billion dollars.  The tax revision program now in Congress will cut taxes by over one and a half billion dollars more.  … Thus the Government is turning back to you about all that we  expect to save this year",3/15/54,Radio and Television Address to the American People on the Tax Program,2
Excise Tax Reduction Act of 1954,3,We are able to stand here and vote for a cut in some excise taxes now because the Eisenho wer administration  recommended economies last year,03/10/1954,"Congressional Record, 83 d Congress, 2d Session, Volume 100—Part 3",3020
Excise Tax Reduction Act of 1954,4,"One of the most compelling and forceful reasons for supporting this measure, inadequate as it is,  arises out of the alarming current unemployment trend throughout the country",03/10/1954,"Congressional Record, 83d Congress, 2d Session, Volume 100—Part 3",3033
Excise Tax Reduction Act of 1954,5,Enactment of this bill into law will add nearly a billion do llars a year to the spending ability of  our people ….  This added purchasing power in the hands of the consumer should aid in reversing the  business trend,,,3021
Excise Tax Reduction Act of 1954,6,The committee believes  that th is reduction will stimulate business and employment,03/04/1954,"83d Congress, 2d Session, House of Representatives Report No. 1307",1
Excise Tax Reduction Act of 1954,7,"Furthermore, this change provides a more equitable tax system by leveling down those rates  which are now excessively high and thus removes discrimination",,House Report No. 1307,1
Excise Tax Reduction Act of 1954,8,w e have every reason to believe  that it will be a stimulating factor in our economy,,,1
Internal Revenue Code of 1954,1,"economic growth will be fostered by  such provisions a s more flexible depreciation and better tax treatment of research and development costs,  thus encouraging all business— large and small —to modernize and expand",8/16/54,Statement by the President Upon Signing Bill Revising the Internal Revenue Code,1
Internal Revenue Code of 1954,2,"In general, the purpose of these changes has been to remove inequities, to end harassment of the  taxpayer and to reduce tax barriers to future expansion of production and employment",03/09/1954,"83 d Congress, 2d Session, House of Representatives Report No. 1337",1
Internal Revenue Code of 1954,3,"A number of additional tax  measures should now be taken in order to strengthen the forces of growth in employment and production.   These measures, which involve some immediate sacrifices of revenue, contain the seeds of important  future revenue gains to be reaped from the economic growth they will stimulate",,,79
Internal Revenue Code of 1954,4,at  this time economic conditions do not call  for an emergency program that would justify larger Federal deficits and further inflation through large  additional tax reductions,3/15/54,Radio and Television Address to the American People on the Tax Program,4
Internal Revenue Code of 1954,5,"This bill is a long overdue reform measure which is vitally necessary regardless of the momentary economic conditions and  should not be confused with other measures which may be, or might become, appropriate in the light of a  particular short -run situation",,House Report No. 1337,01-feb
Social Security Amendments of 1954,1,"Under the provisions of th e bill, the maximum amount of covered earnings considered, for  both tax and benefit purposes, would be raised from $3,600 to $4,200 a year, effective January 1, 1955",,"83 d Congress, 2d Session, House of Representative Report No. 1698",14
Social Security Amendments of 1954,2,"The major reason for this proposal is to maintain the principle of old- age and  survivors insurance … that benefits shou ld, within limits, vary with the individual’s previous earnings.   … Raising the wage base to $4,200 would restore approximately the same relationship between general  earnings levels and the maximum wage base that existed in 1951",,,14- 15
Federal -Aid Hig hway Act of 1956,1,the pressing nature of this problem [inadequate highways] must not lead us to solutions outside the bounds of sound fiscal management,01/05/1956,,9
Federal -Aid Hig hway Act of 1956,2,"To add further to our public debt …, which in the current state of  high prosperity might chiefly serve to raise prices, would be irresponsible",,,75- 76
Federal -Aid Hig hway Act of 1956,3,"It was suggested last year that this vast road program be financed by an independent authority … and that interest and amortization on the highway debt be pa id out of the excess —which may be expected  to increase —of Federal revenues from present gasoline and lubricating oil taxes over current Federal  grants -in-aid for roads.  If this financing plan is not satisfactory to the Congress, a sound alternative not  involving budget deficits should be devised",,,84
Federal -Aid Hig hway Act of 1956,4,The bill is designed to raise sufficient revenue from new and existing highway- user taxes to approximately match estimated Federal highway  expenditures under H.R. 8836,3/19/56,"84 th Congress, 2d Session, House of Representatives Report No. 1899",1
Federal -Aid Hig hway Act of 1956,5,to permit the simultaneous and orderly consideration of all aspects of the highway program,4/21/56,"84th Congress, 2d Session, House of Representatives Report No. 2022",2
Federal -Aid Hig hway Act of 1956,6,to make the highway program self -financing,,,1
Federal -Aid Hig hway Act of 1956,7,"This expansion of the Interstate Highway System, … will  permit the proposed financing to match the authorizations, and keep the financing and construction  programs in balance",05/10/1956,"84th Congress, 2d Session, Senate Report No. 1965",2
Social Security Amendments of 1956,1,"At the time of  the 1950 amendments, as well as since then, Congress has expressed its belief that the insurance program  should be completely self -supporting ….  Accordingly, in the 1956 amendments, the contribution  schedule contained in the 1954 act was revised in recognition of the increased benefit costs involved",,,9
Tax Rate Extension Act of 1958,1,"The prospective surplus is … insufficient to permit the reductions in the corporate income tax rate and in the excise taxes on  automobiles and parts, cigarettes, distilled spirits, wines, and beer scheduled to take effect on July 1,  1958",,,57
Tax Rate Extension Act of 1958,2,[c]onsideration of fiscal measures will continue to be made in the light of t he developing economic  situation and with full regard to both the short and long- range effects of any proposal,5/26/58,,
Tax Rate Extension Act of 1958,3,"In recent months, … various types of tax reductions have been suggested as aids in overcoming  the present economic recession",5/30/58,"85th Congr ess, 2d Session, House of Representatives Report No. 1839",4
Tax Rate Extension Act of 1958,4,"has not as yet, at  least, been convinced that under existing conditions a tax reduction is necessary",,,4
Tax Rate Extension Act of 1958,5,This amendment really is an amendment for the relief of railroads,,,11732
Tax Rate Extension Act of 1958,6,contribute to the financial recovery of the  ‘million -man’ railroad industry,,,11722
Social Security Amendments of 1958,1,"The increase in social security     34   contribution rates and the accelerated tax schedule in the bill will further strengthen the financial  condition of thi s system in the years immediately ahead and over the long -term future.  It is, of course,  essential that the old -age, survivors, and disability insurance program … remain financially sound and  self-supporting",8/29/58,Statement by the President Upon Signing the S ocial Security Amendments,1
Federal -Aid Highway Act of 1959,1,for the purpose of keeping the  Federal -aid highway program on schedule and continuing t he self -sustaining features of the program,9/21/59,,
Federal -Aid Highway Act of 1959,2,The Committee on Ways and Means … decided that for this  year and next it was necessary to provide new revenues to meet the highway trust fund deficit since a  diversion of revenues from the general fund could well lead to unbalanced budgets in this period,09/01/1959,"86th Congress, 1st Session, House of Representatives Report No. 1120",18
Federal -Aid Highway Act of 1959,3,The principal means by which Government can express leadership in the effort to preserve price stability is to conduct its own f inancial  affairs prudently,,,49
Social Security Amendments of 1961,1,"In making the changes in old- age, survivors, and disability insurance, Congress has shown its customary  concern for the financial soundness of the insurance program.  Since the amendments increase the level - premium cost of the program by 0.27 percent of payroll, and since they provide for additional income to  the trust funds that is also estimated at 0.27 percent of payroll, the actuarial balance of the program is not changed and the system remains on a sound f inancial basis",,,8
Social Security Amendments of 1961,2,When I came into office in January 1961 this country w as in a  recession.  We have made a recovery from that recession,8/13/62,,1
Social Security Amendments of 1961,3,"And now we must be concerned with the forward movement of our economy.  The level of our economy … is high but, considering all the resources which this country has, it should be higher",,,2
Social Security Amendments of 1961,4,"measures which I think would  speed up our economy, which are designed to giv e us more jobs and more growth",8/13/62,,3
Social Security Amendments of 1961,5,"will stimulate investment in capacity expansion and modernization, contribute to the growt h of  our productivity and output, and increase the competitiveness of American exports in world markets",,,26
Social Security Amendments of 1961,6,help to stimulate the investment needed for  sustained expansion and longer -run growth,,,18
Social Security Amendments of 1961,7,"the investment credit … is designed to provide a  stimulant to the economic growth of this country.  This is needed both to improve our competitive  position abroad and in the long run to raise our standard of living at home.  On the other hand, the  other  provisions of this bill are designed to improve the equity of our tax structure",,,1
Social Security Amendments of 1961,8,"the investment credit, coupled with the liberalized depreciation, will provide a strong and lasting  stimulus to a high rate of  economic growth",,,8
Revenue Act of 1964,1,"Let me emphasize, however, that I have not been talking  about a different kind of tax cut, a quick, temporary tax cut, to prevent a new recession",8/13/62,,5
Revenue Act of 1964,2,"We approach the issue of tax revision, not in an  atmosphere of haste and panic brought on by recession or depression, but in a period of comparative  calm",,,
Revenue Act of 1964,3,"While the basic purpose of my tax program is to meet  our longer run economic challenges, we should not forget its role in strengthening our defenses against  recession",,,
Revenue Act of 1964,4,This is a record of strong expansion,1/21/64,,3
Revenue Act of 1964,5,"this administration intends to cut  taxes in order to build the fundamental s trength of our economy, to remove a serious barrier to long -term  growth",8/13/62,Radio and Television Report to the American People on the State of the National Economy,4
Revenue Act of 1964,6,"the largest single barrier to full employment of our manpower and resources and to a higher rate of  economic growth is the unrealistically heavy drag of Federal income taxes on private purchasing power,  initiative and incentive",1/24/63,,1
Revenue Act of 1964,7,"The tax cut will give a sustained lift,  year-in and year -out, to the American economy",,,8
Revenue Act of 1964,8,"America has enjoyed 22 months of uninterrupted economic recovery.  But recovery is not  enough.  If we are to prevail in the long run, we  must expand the long -run strength of our economy.  We  must move along the path to a higher rate of growth and full employment",1/14/63,,01-feb
Revenue Act of 1964,9,"despite the creation of 2 1/2 million new jobs in  our economy, the unemployment rate now stands at 5 1/2 %.  Our factories continue to produce below  their optimum rate.  As a nation we are producing at a rate at least $30 billion below our comfortable  capacity",1/21/64,"Annual Budget Message to the Congress, Fiscal Year 1965",3
Revenue Act of 1964,10,"The principal purpose  of the revenue b ill of 1963 is to remove from the private sector of the American economy its present high- tax straitjacket; that is, to lessen restraints which prevent the American free- enterprise system from itself  generating necessary growth.  A purpose of this bill als o is to improve the equity of the tax laws",9/13/63,"88th 39 Congress, 1st Session, House of Representatives Report No. 749",6
Revenue Act of 1964,11,"The bill will cut back on excessive tax rates  which unnecessarily restrain individual and business incentives, it will provide the increased consumer  and business purchasing power to assure continued expansion, and it will improve the equity of the tax  system",1/28/64,"88th Congress, 2d Session, Senate Report No. 830",1
Revenue Act of 1964,12,"Despite the fact that business  conditions have been improving over the past 33 months, unemployment still is at the high rate of 5.5  percent",,Senate Report No. 830,6
Revenue Act of 1964,13,"we have experienced a succession of  disappointing recoveries in which the unemployment rate has remained disturbingly high; this rate, in  fact, has not been below 5 percent since 1957",,,6
Revenue Act of 1964,14,the growth rate of our economy  must be increased if the requisite jobs are to be f ound for this expanding labor force,,,6
